index,Question,Base Model Answer,Fine-tuned Model Answer,Problem/Reason
0,My CT scanner is producing circular ring artifacts on every scan. What is the most likely cause and what should I inspect first?,"The most likely cause of these artifacts would be the use of a rotating scanner. As such, it can be concluded that the CT scan is inaccurate because of this artifact. To begin with, it is important to note that the CT scan is an image of the body from top down; hence, it is a 3D image. Therefore, the artifacts are produced due to the 2D projection of a 3D image on the screen. A simple method to detect and remove the artifacts is by using a software program called NerveGear. This program is free and allows for a 360-degree rotation of the scanner. It also provides the ability to","CT scanners are designed to produce circular ring artifacts at various levels of intensity. These artifacts have been observed in the 30- to 60-cm range, and are generally present at all levels of intensity, from low to high. The ring artifacts may be observed in the axial plane, the coronal plane, or in both planes simultaneously (Figure 1). The ring artifacts may also be observed in the sagittal plane (Figure 2) and in the transverse plane (Figure 3). Figure 1 Coronal view of a CT scan with ring artifacts. Figure 2 Axial view of a CT scan with ring artifact",
1,The CT scanner stopped scanning because of a tube overheating alarm. What components are likely responsible?,"The tube is overheating and the CT scanner is shutting down to prevent a possible fire. In this case, the CT scanner is shutting off because of a tube overheating alarm. The tube is overheating as a result of a tube overheat sensor or thermometer going out. The sensor measures the temperature of the tubes and if it goes above a certain level, then the alarm will sound. As a result, the CT scanner stops scanning until the sensor calibrates itself.","The tube overheated due to a loose tube connector, which allowed air bubbles to escape and cause the tube to heat up. The air in the tube caused it to heat up, which in turn overheated the tube connector. When this happened, the tube overheated. #### Solution A tube overheats when the tube is too hot for the connectors. This can happen when a connector is too tight, or if the connector is not fully seated into its socket. Too much heat can also occur from an air leak, since air can escape from any air leak. A tube overheat can also occur if the t",
2,How does quantization reduce model size?,Quantization reduces the model's size and energy consumption.,The quantized model is 3x smaller than the full model. ### Responses: * The quantized model is 3x smaller than the full model. * The quantized model is 5x smaller than the full model. * The quantized model is 10x smaller than the full model. * The quantized model is 20x smaller than the full model. ### Responses: * The quantized model is 3x smaller than the full model. * The quantized model is 5x smaller than the full model. * The quantized model is 10x smaller than the full model.,
3,My MRI system displays a low helium pressure alarm during scanning. What could be causing this?,The MRI system is displaying an alarm because the helium pressure is too high for the scanner to operate safely. This can happen when the helium pressure exceeds 15 PSI. The system should be turned off and the system reset before scanning begins.,"A: * *The helium pressure was low enough to trigger the alarm but not so low that it would cause a high helium pressure warning. *The pressure sensors are configured to turn on and off based upon the pressure of the helium gas in the system. When the pressure sensor is in a high pressure condition, the pressure sensors turn on to monitor the pressure. When the pressure sensors sense the helium pressure dropping below 20 mbar, they turn off and do not return until the helium pressure reaches at least 145 mbar. *When the pressure sensors sense a high helium pressure (145 mbar), the sensors shut",
4,"The ultrasound probe is connected, but the system cannot detect it. How should I troubleshoot this issue?","To troubleshoot this issue, first check that the system is connected to the ultrasound probe. Then, make sure that the system has a valid serial number. If these two conditions are met, then troubleshooting steps 1-3 must be followed. If you have any questions about troubleshooting, please contact your local Siemens representative or Siemens support.",1) The ultrasound probe is connected properly. 2) The ultrasound system cannot detect the probe. 3) The ultrasound system cannot detect the probe. 4) The ultrasound system cannot detect the probe. 5) The ultrasound system cannot detect the probe. 6) The ultrasound system cannot detect the probe. 7) The ultrasound system cannot detect the probe. 8) The ultrasound system cannot detect the probe. 9) The ultrasound system cannot detect the probe. 10) The ultrasound system cannot detect the probe. ### Solution: 1),
5,The CT gantry will not rotate after startup. Which components should I inspect?,* CT gantry (on/off) * CT head * patient table * patient support * patient lift * patient carts * patient cage ### Assessment - CT gantry is rotating as expected. - Patient table is not rotated. - The patient lift is not rotated. - The patient carts are not rotated. - The patient cage is not rotated.,The CT gantry will not rotate after startup. Which components should I inspect? * * * * * * * * * * * * * * * * * * * * * * * * * * * * * * * * * * * * * * * * * * * * * * * * * * * * * * * * * * * * * * * *,
6,MRI images contain zipper artifacts. What usually causes this type of artifact?,"The most common reason for this type of artifact is a small defect in the MRI tube. This defect could be due to defective shielding, defective shielding material, defective shielding geometry, or defective shielding position. The defect may be small enough that it does not cause a significant amount of noise, but it could still have a negative impact on image quality. To diagnose and remove this artifact, you need to know what kind of defect it is, how much it affects the image, and if it is a new defect or an old defect that was already diagnosed by MRI scanning. If you are unable to diagnose the defect, then you will need to find another way to treat the","The zipper artifacts are caused by the MRI scanner's magnet. This artifact can be minimized by changing the MRI scanner's magnetic field strength or by using a high-frequency coil that is not close to the patient's body. ### Question 3 What are the four main components of an MRI? (a) Slice thickness, (b) T1-weighted image, (c) T2-weighted image, and (d) Axial contrast imaging. ### Response: Slice thickness: The slice thickness is the distance between two points on the MRI scanner's table. It",
7,The ultrasound image is completely black even though the machine powers on. What are the possible causes?,"Ultrasonography machines generate a lot of heat, so the ultrasound device must be kept cool by running the fan at a very low speed to keep the room temperature constant and the fan at full power for a long time. The fan should not run continuously as it may cause the heat generated by the machine to be dissipated too quickly causing overheating of the equipment. If the room is too warm, the fan can be turned off temporarily while the room is cooled down. In addition, the machine can be placed in a small box with an exhaust fan so that the heat can be vented out of the room through the exhaust pipe.","The image is black because the ultrasound device is off and the machine has a power-off switch that is in the ""ON"" position. ## 4.5.2 _Practice Problems for Section 4.5._ **4.5.1** **Problem Solving (Part A).** You are an engineer working as an analyst for an imaging company. You have been hired to evaluate an automated imaging system that will be used in the hospital. The system will take X-ray images, and you need to determine if it meets your specifications. The following are the specifications: • Resolution of 0.6 mm ×",
8,What preventive maintenance should be performed on a CT scanner to reduce unexpected failures?,"Provide a written schedule of preventive maintenance. ### Question: * *What preventive maintenance should be performed on an industrial water pump? *What preventive maintenance should be performed on a car engine? A: Preventive Maintenance Preventive maintenance is the scheduled inspection and cleaning of all equipment that is scheduled to last for one year or more. The purpose of preventive maintenance is to minimize the risk of failure, thus reducing unplanned downtime. * *What preventive maintenance should be performed on a car engine? *What preventive maintenance should be performed on a car engine",- Schedule preventative maintenance visits: - 1 yearly - 2 yearsly - 3 yearsly - Perform a thorough visual inspection of the CT system. - Perform a thorough visual inspection of the CT system ### Discussion: - 1 yearly - 2 yearsly - 3 yearsly ### Conclusion: - 1 yearly - 2 yearsly - 3 yearsly,
9,How can I differentiate between a detector failure and a detector calibration problem in a CT scanner?,"A scanner is a device that takes a series of X-ray images, usually from the top down. The images are then displayed on a computer screen or printed onto paper, as in conventional radiography. The images may be used for diagnostic purposes, such as diagnosing diseases like cancer. They may also be used to help create detailed models of the human body, called CT scans. ### Detector Failure: An uncorrected defect in a CT scanner's X-ray tube leads to a loss of image quality. This defect is typically due to defective components, or a poorly maintained machine. In this case, it is important to determine whether","The response of a CT scanner is the ability to detect objects of interest. It is a property of the detector, not the hardware. The detector calibration process is designed to maintain the response of the scanner at its maximum performance level. I've been working with an older scanner that's had some issues, and I'm trying to determine if this is a software or hardware issue. I'm able to take images with it, but I'd like to get my hands dirty with it. My best guess is that there might be a software issue, but I'm hoping for a more definitive answer than ""maybe"". A: I would say the calibration process",
10,My imaging system repeatedly restarts during operation without displaying any error code. What are the most likely causes?,"A restart is needed because a parameter of your system has been changed (e.g., the time setting in the control panel). This happens automatically when you turn on your system and change settings for the first time after the system has been turned off. I would like to understand how this happens. ### Response: The control panel will restart your system if it cannot find an appropriate signal from the camera. The control panel then starts an internal search for the signal and searches again with a stronger signal. This process takes about 30 seconds, but the search process is not automated. The search continues until the signal can be found or the search time limit is reached.","- The system is restarted because of an abnormal condition such as a power failure, a hardware failure, or a software problem. - The system is restarted to correct an abnormal condition such as a power failure, a hardware failure, or a software problem. - The system is restarted due to a software update. ### Diagnostic Information: - The system is restarted because of a power failure. The system automatically reboots after a power failure. - The system is restarted to correct an abnormal condition such as a power failure, a hardware failure, or a software problem. - The system is restarted due to a software update.",
